{
  "$schema": "http://json-schema.org/draft-07/schema#",
  "$id": "https://trading-platform.io/schemas/order_update.v1.schema.json",
  "title": "Order Update V1",
  "description": "Order status updates from the router",
  "type": "object",
  "properties": {
    "version": {
      "type": "string",
      "pattern": "^\\d+\\.\\d+\\.\\d+$",
      "description": "Schema version in semver format"
    },
    "venue": {
      "type": "string",
      "description": "Exchange/venue name",
      "examples": ["binance", "bybit", "okx"]
    },
    "symbol": {
      "type": "string",
      "description": "Trading pair symbol",
      "examples": ["BTCUSDT", "ETHUSDT"]
    },
    "order_id": {
      "type": "string",
      "description": "Exchange order ID"
    },
    "client_order_id": {
      "type": "string",
      "description": "Our unique order identifier"
    },
    "decision_id": {
      "type": "string",
      "description": "ID of the decision that triggered this order"
    },
    "update_time": {
      "type": "string",
      "format": "date-time",
      "pattern": "^\\d{4}-\\d{2}-\\d{2}T\\d{2}:\\d{2}:\\d{2}(\\.\\d{3})?Z$",
      "description": "Time of the status update"
    },
    "status": {
      "type": "string",
      "enum": ["pending", "new", "partially_filled", "filled", "cancelled", "rejected", "expired"],
      "description": "Current order status"
    },
    "side": {
      "type": "string",
      "enum": ["buy", "sell"],
      "description": "Order side"
    },
    "order_type": {
      "type": "string",
      "enum": ["market", "limit", "stop_market", "stop_limit"],
      "description": "Order type"
    },
    "price": {
      "type": ["string", "null"],
      "description": "Order price (null for market orders)"
    },
    "stop_price": {
      "type": ["string", "null"],
      "description": "Stop price (for stop orders)"
    },
    "quantity": {
      "type": "string",
      "description": "Order quantity"
    },
    "filled_quantity": {
      "type": "string",
      "description": "Filled quantity"
    },
    "average_fill_price": {
      "type": ["string", "null"],
      "description": "Average fill price"
    },
    "commission": {
      "type": ["number", "null"],
      "description": "Commission paid"
    },
    "commission_asset": {
      "type": ["string", "null"],
      "description": "Commission asset"
    },
    "error_message": {
      "type": ["string", "null"],
      "description": "Error message if order failed"
    },
    "is_reduce_only": {
      "type": "boolean",
      "description": "Whether this is a reduce-only order (futures)"
    }
  },
  "required": [
    "version",
    "venue",
    "symbol",
    "order_id",
    "client_order_id",
    "decision_id",
    "update_time",
    "status",
    "side",
    "order_type",
    "price",
    "stop_price",
    "quantity",
    "filled_quantity",
    "average_fill_price",
    "commission",
    "commission_asset",
    "error_message",
    "is_reduce_only"
  ],
  "additionalProperties": false
}